{
  "schema_version": "1.0.0",
  "submission_id": "hsub-example-review-0001",
  "revision": 1,
  "created_at": "2026-07-15T10:30:00Z",
  "target": {
    "review_id": "review-example",
    "review_version": "1.0.0",
    "release_manifest_sha256": "1111111111111111111111111111111111111111111111111111111111111111",
    "selector": {
      "kind": "claim",
      "claim_id": "clm_3f6806d566c1ba52"
    }
  },
  "submitter": {
    "identity_ref": "identity-example-0001",
    "display_name": "Example Reviewer",
    "visibility": "public",
    "orcid": "https://orcid.org/0000-0002-1825-0097",
    "affiliations": [
      "Example Institute"
    ]
  },
  "content": {
    "kind": "peer_review",
    "title": "The claim needs a narrower population qualifier",
    "body_markdown": "The cited study supports this conclusion in the sampled population, but the review currently presents it as population-independent. I recommend narrowing the sentence and recording the sampling boundary.",
    "stance": "qualifies",
    "recommendation": "minor_revision",
    "confidence": 4,
    "evidence": [
      {
        "type": "doi",
        "identifier": "10.0000/example-doi",
        "supports": "Reports the population and sampling frame relevant to the proposed qualifier."
      }
    ]
  },
  "declarations": {
    "license": "CC-BY-4.0",
    "public_record_consent": true,
    "competing_interests": "No competing interests declared.",
    "contains_confidential_information": false,
    "ethical_guidelines_acknowledged": true,
    "ai_assistance": {
      "used": false
    }
  },
  "moderation": {
    "state": "accepted",
    "events": [
      {
        "event": "submitted",
        "at": "2026-07-15T10:30:00Z",
        "actor_ref": "identity-example-0001"
      },
      {
        "event": "admitted",
        "at": "2026-07-15T12:00:00Z",
        "actor_ref": "editor-example",
        "reason": "Passed scope, disclosure, privacy, and conduct screening."
      },
      {
        "event": "accepted",
        "at": "2026-07-15T13:00:00Z",
        "actor_ref": "editor-example",
        "reason": "Accepted as a public review record and queued for the next revision."
      }
    ]
  },
  "provenance": {
    "intake_channel": "github_issue",
    "source_url": "https://github.com/example/review/issues/42",
    "received_at": "2026-07-15T10:30:01Z",
    "payload_sha256": "2222222222222222222222222222222222222222222222222222222222222222"
  }
}
